{
  "schema_version": "intake-turn-proposal.v2",
  "command_id": "COMMAND_P4_USER_2",
  "logical_run_id": "RUN_P4_USER_2",
  "attempt_id": "ATTEMPT_P4_USER_2_1",
  "case_id": "CASE_P4_SYNTHETIC_1",
  "room_epoch": 1,
  "thread_id": "grt.v1.018f6b7ec30a7430982fffc520c8195c",
  "actor_scope_hash": "52f01901287fe5e5465ddcd7d7baf9074aa77e3d88a64da747bf1f530916a5d2",
  "agent_session_id": "AGENT_SESSION_P4_USER_1",
  "cognitive_revision": 2,
  "source_snapshot_hash": "a576823e72e44f62b08249af84f295fe5cc3ac09f3335ab96b2846fa7e5f9743",
  "source_event_hash": "5da4ebd5b5ff75ea8af5c955c01f2cf18138892d07ad6ca74be7c7fb50ff5815",
  "room_utterance": "Please confirm the requested resolution before submission.",
  "dossier_patch": {
    "schema_version": "intake-dossier.v2",
    "case_story": {"one_sentence_summary": "Synthetic damaged-order dispute."},
    "requested_resolution": {"kind": "REFUND"}
  },
  "matrix_patch": null,
  "readiness": "INCOMPLETE",
  "missing_fields": ["requested_resolution_detail"],
  "recommendation": "NEED_MORE_INFO",
  "knowledge_answer_mode": "NONE",
  "confidence": 0.82,
  "profile_versions": {
    "graph_version": "2.0.0",
    "checkpoint_schema_version": "intake-checkpoint.v2",
    "prompt_version": "intake-prompt.v2",
    "model_profile_id": "intake-model.synthetic.v1",
    "output_schema_version": "intake-turn-proposal.v2",
    "policy_version": "intake-policy.v2",
    "guardrail_version": "intake-guardrail.v2",
    "tool_policy_version": "no-tools.v1"
  },
  "proposal_hash": "c37196fce02833a2d4486831a1b8ee3a4a6c075d9041909dde99d1edece2e064"
}
